<?xml version="1.0" encoding="UTF-8"?>
<!DOCTYPE r
  PUBLIC "-//XMLmind//DTD smenob//SE" "../scripts/smenob.dtd">
<r>
   <e src="nj">
      <lg>
         <l pos="adv">eret</l>
      </lg>
      <mg>
         <tg>
            <t pos="adv">bort</t>
         </tg>
      </mg>
   </e>
   <e src="nj">
      <lg>
         <l pos="adv">albma</l>
      </lg>
      <mg>
         <tg>
            <t pos="adv">ordentlig</t>
            <t pos="adv">skikkelig</t>
         </tg>
      </mg>
   </e>
   <e src="nj">
      <lg>
         <l pos="adv">sahtedohko</l>
      </lg>
      <mg>
         <tg>
            <t pos="adv">tilfeldig</t>
         </tg>
      </mg>
      <mg>
         <tg>
            <t pos="adv">uforsiktig</t>
         </tg>
      </mg>
   </e>
</r>