<?xml version="1.0" encoding="UTF-8"?>
<!DOCTYPE r
  PUBLIC "-//XMLmind//DTD smenob//SE" "../scripts/smenob.dtd">
<r>
   <e>
      <lg>
         <l pos="n">vuoigatvuođalávdegoddi</l>
      </lg>
      <mg>
         <tg>
            <t nr="sg" pos="n">rettighetsutvalg</t>
         </tg>
      </mg>
   </e>
   <e>
      <lg>
         <l pos="n">giellaráđđi</l>
      </lg>
      <mg>
         <tg>
            <t pos="n">språkråd</t>
         </tg>
      </mg>
   </e>
   <e>
      <lg>
         <l pos="n">sámediggejoavku</l>
      </lg>
      <mg>
         <tg>
            <t pos="f">sametingsgruppe</t>
         </tg>
      </mg>
   </e>
   <e>
      <lg>
         <l pos="n">audio-visuála</l>
      </lg>
      <mg>
         <tg>
            <t pos="a">audio-visual</t>
         </tg>
      </mg>
   </e>
   <e>
      <lg>
         <l pos="n">A-vitamiidna</l>
      </lg>
      <mg>
         <tg>
            <t pos="n">A-vitamin</t>
         </tg>
      </mg>
   </e>
</r>