<?xml version="1.0" encoding="UTF-8"?>
<!DOCTYPE r
  PUBLIC "-//XMLmind//DTD smenob//SE" "../scripts/smenob.dtd">
<r>
   <e usage="ped" src="nj">
      <lg>
         <l pos="v" context="mun">leat</l>
	 <analysis>IV_Inf</analysis>
         <analysis>IV_Ind_Prs_Inf</analysis>
         <mini_paradigm>
            <analysis ms="IV_Ind_Prs_Sg1">
               <wordform>lean</wordform>
            </analysis>
            <analysis ms="IV_Ind_Prs_Sg2">
               <wordform>leat</wordform>
            </analysis>
            <analysis ms="IV_Ind_Prs_Sg3">
               <wordform>lea</wordform>
            </analysis>
            <analysis ms="IV_Ind_Prs_Du1">
               <wordform>letne</wordform>
            </analysis>
            <analysis ms="IV_Ind_Prs_Du2">
               <wordform>leahppi</wordform>
            </analysis>
            <analysis ms="IV_Ind_Prs_Du3">
               <wordform>leaba</wordform>
            </analysis>
            <analysis ms="IV_Ind_Prs_Pl1">
               <wordform>leat</wordform>
            </analysis>
            <analysis ms="IV_Ind_Prs_Pl2">
               <wordform>lehpet</wordform>
            </analysis>
            <analysis ms="IV_Ind_Prs_Pl3">
               <wordform>leat</wordform>
            </analysis>
            <analysis ms="IV_Ind_Prt_Sg1">
               <wordform>ledjen</wordform>
            </analysis>
            <analysis ms="IV_Ind_Prt_Sg2">
               <wordform>ledjet</wordform>
            </analysis>
            <analysis ms="IV_Ind_Prt_Sg3">
               <wordform>leai</wordform>
               <wordform>lei</wordform>
            </analysis>
            <analysis ms="IV_Ind_Prt_Du1">
               <wordform>leimme</wordform>
            </analysis>
            <analysis ms="IV_Ind_Prt_Du2">
               <wordform>leidde</wordform>
            </analysis>
            <analysis ms="IV_Ind_Prt_Du3">
               <wordform>leigga</wordform>
            </analysis>
            <analysis ms="IV_Ind_Prt_Pl1">
               <wordform>leimmet</wordform>
            </analysis>
            <analysis ms="IV_Ind_Prt_Pl2">
               <wordform>leiddet</wordform>
            </analysis>
            <analysis ms="IV_Ind_Prt_Pl3">
               <wordform>ledje</wordform>
            </analysis>
         </mini_paradigm>
      </lg>
      <mg>
         <tg>
            <t pos="v">er</t>
            <t pos="v">har</t>
         </tg>
      </mg>
   </e>
   <e usage="ped" src="nj">
      <lg>
         <l pos="v">lean</l>
         <lemma_ref>leat</lemma_ref>
         <analysis>IV_Ind_Prs_Sg1</analysis>
      </lg>
      <mg>
         <tg>
            <t pos="v">er</t>
            <t pos="v">har</t>
         </tg>
      </mg>
   </e>
   <e usage="ped" src="nj">
      <lg>
         <l pos="v">leat</l>
         <lemma_ref>leat</lemma_ref>
         <analysis>IV_Ind_Prs_Sg2</analysis>
      </lg>
      <mg>
         <tg>
            <t pos="v">er</t>
            <t pos="v">har</t>
         </tg>
      </mg>
   </e>
   <e usage="ped" src="nj">
      <lg>
         <l pos="v">lea</l>
         <lemma_ref>leat</lemma_ref>
         <analysis>IV_Ind_Prs_Sg3</analysis>
      </lg>
      <mg>
         <tg>
            <t pos="v">er</t>
            <t pos="v">har</t>
         </tg>
      </mg>
   </e>
   <e usage="ped" src="nj">
      <lg>
         <l pos="v">letne</l>
         <lemma_ref>leat</lemma_ref>
         <analysis>IV_Ind_Prs_Du1</analysis>
      </lg>
      <mg>
         <tg>
            <t pos="v">er</t>
            <t pos="v">har</t>
         </tg>
      </mg>
   </e>
   <e usage="ped" src="nj">
      <lg>
         <l pos="v">leahppi</l>
         <lemma_ref>leat</lemma_ref>
         <analysis>IV_Ind_Prs_Du2</analysis>
      </lg>
      <mg>
         <tg>
            <t pos="v">er</t>
            <t pos="v">har</t>
         </tg>
      </mg>
   </e>
   <e usage="ped" src="nj">
      <lg>
         <l pos="v">leaba</l>
         <lemma_ref>leat</lemma_ref>
         <analysis>IV_Ind_Prs_Du3</analysis>
      </lg>
      <mg>
         <tg>
            <t pos="v">er</t>
            <t pos="v">har</t>
         </tg>
      </mg>
   </e>
   <e usage="ped" src="nj">
      <lg>
         <l pos="v">leat</l>
         <lemma_ref>leat</lemma_ref>
         <analysis>IV_Ind_Prs_Pl1</analysis>
      </lg>
      <mg>
         <tg>
            <t pos="v">er</t>
            <t pos="v">har</t>
         </tg>
      </mg>
   </e>
   <e usage="ped" src="nj">
      <lg>
         <l pos="v">lehpet</l>
         <lemma_ref>leat</lemma_ref>
         <analysis>IV_Ind_Prs_Pl2</analysis>
      </lg>
      <mg>
         <tg>
            <t pos="v">er</t>
            <t pos="v">har</t>
         </tg>
      </mg>
   </e>
   <e usage="ped" src="nj">
      <lg>
         <l pos="v">leat</l>
         <lemma_ref>leat</lemma_ref>
         <analysis>IV_Ind_Prs_Pl3</analysis>
      </lg>
      <mg>
         <tg>
            <t pos="v">er</t>
            <t pos="v">har</t>
         </tg>
      </mg>
   </e>
   <e usage="ped" src="nj">
      <lg>
         <l pos="v">ledjen</l>
         <lemma_ref>leat</lemma_ref>
         <analysis>IV_Ind_Prt_Sg1</analysis>
      </lg>
      <mg>
         <tg>
            <t pos="v">var</t>
            <t pos="v">hadde</t>
         </tg>
      </mg>
   </e>
   <e usage="ped" src="nj">
      <lg>
         <l pos="v">ledjet</l>
         <lemma_ref>leat</lemma_ref>
         <analysis>IV_Ind_Prt_Sg2</analysis>
      </lg>
      <mg>
         <tg>
            <t pos="v">var</t>
            <t pos="v">hadde</t>
         </tg>
      </mg>
   </e>
   <e usage="ped" src="nj">
      <lg>
         <l pos="v">lei</l>
         <lemma_ref>leat</lemma_ref>
         <analysis>IV_Ind_Prt_Sg3</analysis>
      </lg>
      <mg>
         <tg>
            <t pos="v">var</t>
            <t pos="v">hadde</t>
         </tg>
      </mg>
   </e>
   <e usage="ped" src="nj">
      <lg>
         <l pos="v">leai</l>
         <lemma_ref>leat</lemma_ref>
         <analysis>IV_Ind_Prt_Sg3</analysis>
      </lg>
      <mg>
         <tg>
            <t pos="v">var</t>
            <t pos="v">hadde</t>
         </tg>
      </mg>
   </e>
   <e usage="ped" src="nj">
      <lg>
         <l pos="v">leimme</l>
         <lemma_ref>leat</lemma_ref>
         <analysis>IV_Ind_Prt_Du1</analysis>
      </lg>
      <mg>
         <tg>
            <t pos="v">var</t>
            <t pos="v">hadde</t>
         </tg>
      </mg>
   </e>
   <e usage="ped" src="nj">
      <lg>
         <l pos="v">leidde</l>
         <lemma_ref>leat</lemma_ref>
         <analysis>IV_Ind_Prt_Du2</analysis>
      </lg>
      <mg>
         <tg>
            <t pos="v">var</t>
            <t pos="v">hadde</t>
         </tg>
      </mg>
   </e>
   <e usage="ped" src="nj">
      <lg>
         <l pos="v">leigga</l>
         <lemma_ref>leat</lemma_ref>
         <analysis>IV_Ind_Prt_Du3</analysis>
      </lg>
      <mg>
         <tg>
            <t pos="v">var</t>
            <t pos="v">hadde</t>
         </tg>
      </mg>
   </e>
   <e usage="ped" src="nj">
      <lg>
         <l pos="v">leimmet</l>
         <lemma_ref>leat</lemma_ref>
         <analysis>IV_Ind_Prt_Pl1</analysis>
      </lg>
      <mg>
         <tg>
            <t pos="v">var</t>
            <t pos="v">hadde</t>
         </tg>
      </mg>
   </e>
   <e usage="ped" src="nj">
      <lg>
         <l pos="v">leiddet</l>
         <lemma_ref>leat</lemma_ref>
         <analysis>IV_Ind_Prt_Pl2</analysis>
      </lg>
      <mg>
         <tg>
            <t pos="v">var</t>
            <t pos="v">hadde</t>
         </tg>
      </mg>
   </e>
   <e usage="ped" src="nj">
      <lg>
         <l pos="v">ledje</l>
         <lemma_ref>leat</lemma_ref>
         <analysis>IV_Ind_Prt_Pl3</analysis>
      </lg>
      <mg>
         <tg>
            <t pos="v">var</t>
            <t pos="v">hadde</t>
         </tg>
      </mg>
   </e>
</r>
