<?xml version="1.0" encoding="UTF-8"?>
<!DOCTYPE r
  PUBLIC "-//XMLmind//DTD smenob//SE" "../scripts/smenob.dtd">
<r>
   <e>
      <lg>
         <l pos="a" context="olmmoš">spiehkasteaddji</l>
      </lg>
      <mg>
         <tg>
            <t pos="a">avvikende</t>
         </tg>
      </mg>
   </e>
   <e>
      <lg>
         <l pos="a" context="olmmoš">triviála</l>
      </lg>
      <mg>
         <tg>
            <t pos="a">trivial</t>
         </tg>
      </mg>
   </e>
   <e>
      <lg>
         <l pos="a" context="olmmoš">ulbmilaš</l>
      </lg>
      <mg>
         <tg>
            <t pos="a">strategisk</t>
         </tg>
      </mg>
   </e>
</r>