<?xml version="1.0" encoding="UTF-8"?>
<!DOCTYPE r
  PUBLIC "-//XMLmind//DTD smenob//SE" "../scripts/smenob.dtd">
<r>
   <e usage="ped" src="nj">
      <lg>
         <l pos="v" context="mun">ii</l>
         <analysis>Verb_Prs_Sg3</analysis>
         <mini_paradigm>
            <analysis ms="Verb_Prs_Sg1">
               <wordform>in</wordform>
            </analysis>
            <analysis ms="Verb_Prs_Sg2">
               <wordform>it</wordform>
            </analysis>
            <analysis ms="Verb_Prs_Sg3">
               <wordform>ii</wordform>
            </analysis>
            <analysis ms="Verb_Prs_Du1">
               <wordform>ean</wordform>
            </analysis>
            <analysis ms="Verb_Prs_Du2">
               <wordform>eahppi</wordform>
            </analysis>
            <analysis ms="Verb_Prs_Du3">
               <wordform>eaba</wordform>
            </analysis>
            <analysis ms="Verb_Prs_Pl1">
               <wordform>eat</wordform>
            </analysis>
            <analysis ms="Verb_Prs_Pl2">
               <wordform>ehpet</wordform>
            </analysis>
            <analysis ms="Verb_Prs_Pl3">
               <wordform>eai</wordform>
            </analysis>
         </mini_paradigm>
      </lg>
      <mg>
         <tg>
            <t pos="v">ikke</t>
         </tg>
      </mg>
   </e>

   <e>
      <lg>
         <l pos="pron_dublu_in">in</l>
         <lemma_ref>ii</lemma_ref>
         <analysis>Verb_Prs_Sg1</analysis>
      </lg>
      <mg>
         <tg>
            <t pos="pron">ikke</t>
         </tg>
      </mg>
   </e>
   <e>
      <lg>
         <l pos="pron_dublu_it">it</l>
         <lemma_ref>ii</lemma_ref>
         <analysis>Verb_Prs_Sg2</analysis>
      </lg>
      <mg>
         <tg>
            <t pos="pron">ikke</t>
         </tg>
      </mg>
   </e>
   <e>
      <lg>
         <l pos="pron_dublu_ii">ii</l>
         <lemma_ref>ii</lemma_ref>
         <analysis>Verb_Prs_Sg3</analysis>
      </lg>
      <mg>
         <tg>
            <t pos="pron">ikke</t>
         </tg>
      </mg>
   </e>
   <e>
      <lg>
         <l pos="pron_dublu_ean">ean</l>
         <lemma_ref>ii</lemma_ref>
         <analysis>Verb_Prs_Du1</analysis>
      </lg>
      <mg>
         <tg>
            <t pos="pron">ikke</t>
         </tg>
      </mg>
   </e>
   <e>
      <lg>
         <l pos="pron_dublu_eahppi">eahppi</l>
         <lemma_ref>ii</lemma_ref>
         <analysis>Verb_Prs_Du2</analysis>
      </lg>
      <mg>
         <tg>
            <t pos="pron">ikke</t>
         </tg>
      </mg>
   </e>
   <e>
      <lg>
         <l pos="pron_dublu_eaba">eaba</l>
         <lemma_ref>ii</lemma_ref>
         <analysis>Verb_Prs_Du3</analysis>
      </lg>
      <mg>
         <tg>
            <t pos="pron">ikke</t>
         </tg>
      </mg>
   </e>
   <e>
      <lg>
         <l pos="pron_dublu_eat">eat</l>
         <lemma_ref>ii</lemma_ref>
         <analysis>Verb_Prs_Pl1</analysis>
      </lg>
      <mg>
         <tg>
            <t pos="pron">ikke</t>
         </tg>
      </mg>
   </e>
   <e>
      <lg>
         <l pos="pron_dublu_ehpet">ehpet</l>
         <lemma_ref>ii</lemma_ref>
         <analysis>Verb_Prs_Pl2</analysis>
      </lg>
      <mg>
         <tg>
            <t pos="pron">ikke</t>
         </tg>
      </mg>
   </e>
   <e>
      <lg>
         <l pos="pron_dublu_eai">eai</l>
         <lemma_ref>ii</lemma_ref>
         <analysis>Verb_Prs_Pl3</analysis>
      </lg>
      <mg>
         <tg>
            <t pos="pron">ikke</t>
         </tg>
      </mg>
   </e>
   
   
   
</r>